Tiêu đề,Đường dẫn,Mô tả
Top 10 công ty thiết kế nội thất uy tín ở Bình Dương chuyên nghiệp ...,www.lanha.vn,"Jul 25, 2023 ... Tổng hợp các công ty thiết kế nội thất tại Bình Dương uy tín, chuyên nghiệp: Là Nhà, 3A Home, On Home Asia,... Xem ngay để lựa chọn đơn vị ..."
công ty nội thất ở tại bình dương,www.yellowpages.vn,"Nội Thất Gỗ Đại Ngàn là đơn vị chuyên thiết kế, sản xuất và cung cấp các sản phẩm nội thất chất lượng cao, đáp ứng nhu cầu đa dạng của khách hàng. Đa dạng các ..."
Nội Thất ở bình dương - danh sách các công ty Nội Thất ở bình dương,trangvangvietnam.com,"VPGD TP.HCM: Lầu 4, Bách Việt Building, 65 Trần Quốc Hoàn, P. 4, Q. Tân Bình, TP. Hồ Chí Minh. ĐKKD-MST số: 0104478506 - Do: Sở Kế Hoạch & Đầu Tư Hà Nội cấp."
"Cháy lớn tại công ty nội thất ở Bình Dương, nhiều tài sản bị thiêu rụi",congan.com.vn,"Dec 3, 2024 ... (CAO) Ngày 3-12, Công an TP Thủ Dầu Một, tỉnh Bình Dương đang điều tra nguyên nhân vụ hoả hoạn thiêu rụi hàng trăm mét vuông nhà xưởng của một ..."
sản xuất đồ nội thất ở tại bình dương,trangvangvietnam.com,CÔNG TY TNHH NộI THấT HOÀNG ANH. CÔNG TY TNHH NộI THấT XÂY DựNG MYHOME ; CÔNG TY Cổ PHầN SảN XUấT VÁN SÀN HOÀNG PHÚC. CÔNG TY TNHH MTV KIM XươNG HUY-PHU KIEN GO.
Cháy lớn công ty nội thất ở Bình Dương - Báo VnExpress,vnexpress.net,"Nov 23, 2024 ... Lửa bùng lên tại khu vực sản xuất công ty nội thất ở TP Bến Cát rồi nhanh chóng cháy lan nhà xưởng rộng chừng 1.000 m2, sáng 23/11."
[Top 10+] Công ty thiết kế nội thất Bình Dương uy tín hàng đầu,sbshouse.vn,1.1. Công ty thiết kế thi công nội thất Bình Dương – SBS HOUSE · 1.2. Công ty tư vấn thiết kế nội thất ở Bình Dương On Home Asia · 1.3. Công ty nội thất Kim Trọng ...
Lửa bao trùm công ty nội thất ở Bình Dương sau tiếng nổ lớn | Báo ...,tienphong.vn,"May 9, 2022 ... Sau tiếng nổ lớn, khói lửa bốc lên ngùn ngụt tại một công ty sản xuất nội thất ở Bình Dương. Lực lượng chức năng địa phương đang nỗ lực ..."
"Top 10 Showroom Nội Thất Bình Dương Uy Tín, Giá Rẻ",sofadepgiare.vn,"Jul 13, 2023 ... T&T Interior Design tự hào là đơn vị nhượng quyền thương hiệu CABINET Pro của Công Ty Cổ phần Gỗ An Cường. T&T Interior Design hiện tại là đơn ..."
15+ Cửa hàng nội thất Bình Dương Uy tín và giá tốt nhất,noithattana.net,"Feb 9, 2023 ... Được khách hàng biết đến là công ty bán nội thất gia đình, văn phòng uy tín, tin cậy tại Bình Dương. Quốc Khánh có một phòng trưng bày rộng ..."
